{
  "contract_version": 1,
  "name": "support_tickets",
  "description": "MongoDB support tickets. Incremental on _id (ObjectId); created_at is a string in Mongo so it cannot be a watermark.",
  "source": "mongodb_source",
  "source_schema": "banking_support_db",
  "source_table": "support_tickets",
  "target_schema": "raw",
  "target_table": "support_tickets",
  "business_key": [
    "_id"
  ],
  "load_strategy": "incremental",
  "incremental_column": "_id",
  "watermark_strategy": "objectid",
  "num_partitions": 2,
  "columns": [
    {
      "name": "_id",
      "type": "text",
      "nullable": false,
      "key": true
    },
    {
      "name": "ticket_id",
      "type": "text",
      "nullable": true
    },
    {
      "name": "customer_id",
      "type": "bigint",
      "nullable": true
    },
    {
      "name": "issue_type",
      "type": "text",
      "nullable": true
    },
    {
      "name": "status",
      "type": "text",
      "nullable": true
    },
    {
      "name": "date_opened",
      "type": "date",
      "nullable": true
    },
    {
      "name": "date_resolved",
      "type": "date",
      "nullable": true
    },
    {
      "name": "satisfaction_score",
      "type": "integer",
      "nullable": true
    },
    {
      "name": "created_at",
      "type": "timestamptz",
      "nullable": true
    }
  ],
  "quality": {
    "row_count": {
      "mode": "source_vs_landed_exact",
      "severity": "ERROR"
    },
    "freshness": {
      "mode": "max_loaded_at_within_window",
      "window": "PT24H",
      "compare": "landing_loaded_at",
      "severity": "WARNING"
    }
  },
  "owner": "banking-data-platform",
  "tags": [
    "incremental",
    "mongodb"
  ]
}
