{
  "contract_version": 1,
  "name": "employees",
  "description": "MySQL employee master. Full load.",
  "source": "mysql_source",
  "source_schema": "banking_core_db",
  "source_table": "employees",
  "target_schema": "raw",
  "target_table": "employees",
  "business_key": [
    "employee_id"
  ],
  "load_strategy": "full",
  "num_partitions": 4,
  "columns": [
    {
      "name": "employee_id",
      "type": "bigint",
      "nullable": false,
      "key": true
    },
    {
      "name": "name",
      "type": "text",
      "nullable": true
    },
    {
      "name": "branch_id",
      "type": "bigint",
      "nullable": true
    },
    {
      "name": "role",
      "type": "text",
      "nullable": true
    },
    {
      "name": "hire_date",
      "type": "date",
      "nullable": true
    },
    {
      "name": "salary",
      "type": "numeric(18,2)",
      "nullable": true
    },
    {
      "name": "created_at",
      "type": "timestamptz",
      "nullable": true
    }
  ],
  "quality": {
    "row_count": {
      "mode": "source_vs_landed_exact",
      "severity": "ERROR"
    },
    "freshness": {
      "mode": "max_loaded_at_within_window",
      "window": "PT24H",
      "compare": "landing_loaded_at",
      "severity": "WARNING"
    }
  },
  "owner": "banking-data-platform",
  "tags": [
    "master-data"
  ]
}
